{
  "$schema": "https://appsdk.local/contracts/records/evidence-record.schema.json",
  "evidence_id": "evid-20260816-zarchv2-activev4-artifact-001",
  "issue_id": "zterm-runtime-architecture-v2",
  "experiment_id": "zterm-runtime-architecture-v2-active-v4",
  "phase": "artifact",
  "kind": "artifact",
  "source_commit": "0a6a1d204374bb55db82aa9f66d01765fb6a80db",
  "artifact_hash": "sha256:75dec58077a00acf1f4f0895c5ad314edbe1411ea6697728b469d8dadbb1fc04",
  "scope": {
    "module_id": "zterm-runtime-v2",
    "feature_id": "zterm_runtime_architecture_v2_appsdk_013_active_v4_final_gates",
    "entrypoint": "appsdk compile-module android --module zterm-runtime-v2"
  },
  "producer": {
    "adapter": "appsdk",
    "identity": "appsdk-0.1.3"
  },
  "result": "pass",
  "confidence": 1,
  "confidence_rationale": "AppSDK 0.1.3 compiled the active-v4 module artifact and verified its source, contract, and public API hashes at 0a6a1d2.",
  "created_at": "2026-08-17T05:45:00Z",
  "expires_at": "2026-11-14T00:00:00Z",
  "input_hashes": [
    "sha256:75dec58077a00acf1f4f0895c5ad314edbe1411ea6697728b469d8dadbb1fc04",
    "git:0a6a1d204374bb55db82aa9f66d01765fb6a80db"
  ],
  "scope_hash": "sha256:ad06d8f40b865c3b89440b0b0049a7c4a87ae9538a2163f98edf18903f31ac21"
}
