{
  "$schema": "https://appsdk.local/contracts/records/evidence-record.schema.json",
  "evidence_id": "evid-20260817-zarchv2-activev4-main-artifact-001",
  "issue_id": "zterm-runtime-architecture-v2",
  "experiment_id": "zterm-runtime-architecture-v2-active-v4-main-closeout",
  "phase": "artifact",
  "kind": "artifact",
  "source_commit": "86076987a70345d88b90070f0014e8b2f243ca01",
  "artifact_hash": "sha256:0db5a982ad07ac58242564fb3b76fb951ecf2de0047aaf14f474b68115198841",
  "scope": {
    "module_id": "zterm-runtime-v2",
    "feature_id": "zterm_runtime_architecture_v2_active_v4_main_artifact",
    "entrypoint": "appsdk compile-module android --module zterm-runtime-v2"
  },
  "producer": {
    "adapter": "appsdk",
    "identity": "appsdk-0.1.3"
  },
  "result": "pass",
  "confidence": 1,
  "confidence_rationale": "AppSDK compiled artifact sha256:0db5a982ad07ac58242564fb3b76fb951ecf2de0047aaf14f474b68115198841 with source sha256:61fe293ab2cf3176e94f0b3af6fa477def0750bfdf01965ca19f122904163b07 and public API sha256:ba699c8ee9f7f89d75e625dee2d6261ef89290e74160a00ba6213934e4bf4808.",
  "created_at": "2026-08-18T10:40:00Z",
  "expires_at": "2026-11-16T00:00:00Z",
  "input_hashes": [
    "sha256:0db5a982ad07ac58242564fb3b76fb951ecf2de0047aaf14f474b68115198841",
    "git:86076987a70345d88b90070f0014e8b2f243ca01"
  ],
  "scope_hash": "sha256:e939fc3be8c64425b047abeb47a1c108890be6427825360f742cb7b44edb9790"
}
