{
  "$schema": "https://appsdk.local/contracts/records/evidence-record.schema.json",
  "evidence_id": "evid-20260816-zarchv2-activev4-post-positive-001",
  "issue_id": "zterm-runtime-architecture-v2",
  "experiment_id": "zterm-runtime-architecture-v2-active-v4",
  "phase": "positive_intervention",
  "kind": "positive_test",
  "source_commit": "f70f156635e6ed48e0f50c30d8aed86fa614a432",
  "artifact_hash": "sha256:45e60a6c9f51069893619ed61a25575ffecdcf2de6b8895f8a1879f6c04da710",
  "scope": {
    "module_id": "zterm-runtime-v2",
    "feature_id": "zterm_runtime_architecture_v2_appsdk013_final_gates",
    "entrypoint": "vitest run src/lib/lifecycle-contract-truth.test.ts src/lib/feature-registry-truth.test.ts"
  },
  "producer": {
    "adapter": "codex+vitest",
    "identity": "codex-zterm-v2-activev4-post-positive-20260816T073000Z"
  },
  "result": "pass",
  "confidence": 1,
  "confidence_rationale": "Post-review replay confirms the unchanged candidate still passes the lifecycle contract gate, the feature registry gate, and AppSDK verify.",
  "created_at": "2026-08-16T07:30:00Z",
  "expires_at": "2026-11-14T00:00:00Z",
  "input_hashes": [
    "sha256:45e60a6c9f51069893619ed61a25575ffecdcf2de6b8895f8a1879f6c04da710",
    "git:f70f156635e6ed48e0f50c30d8aed86fa614a432"
  ],
  "scope_hash": "sha256:609824e13a30f94a639027b649769646818180c4bc299076380396be52cbbd1e"
}
