{
  "$schema": "https://appsdk.local/contracts/records/evidence-record.schema.json",
  "evidence_id": "evid-20260818-zarchv2-activev4-mainmerged-regression-001",
  "issue_id": "zterm-runtime-architecture-v2",
  "experiment_id": "zterm-runtime-architecture-v2-active-v4",
  "phase": "regression",
  "kind": "sample_replay",
  "source_commit": "b941affb7c89021bb5662a7686fc52847a639e6c",
  "artifact_hash": "sha256:35fa8b353330c1969f5f5147aeed65dfcf7775fb4e6295a39ac9bc714d4a43be",
  "scope": {
    "module_id": "zterm-runtime-v2",
    "feature_id": "zterm_runtime_architecture_v2_appsdk_013_active_v4_final_gates",
    "entrypoint": "pnpm exec vitest run --no-file-parallelism src/lib/feature-registry-truth.test.ts src/lib/android-network-identity-truth.test.ts src/server/client-session-lifecycle.test.ts src/server/server.transport-runtime-truth.test.ts src/components/TerminalView.dynamic-refresh.test.tsx src/App.dynamic-refresh.test.tsx src/contexts/session-context-buffer-runtime.test.ts"
  },
  "producer": {
    "adapter": "vitest",
    "identity": "codex-zterm-v2-activev4-mainmerged-regression-20260818T123000Z"
  },
  "result": "pass",
  "confidence": 1,
  "confidence_rationale": "Regression replay on detached worktree at b941aff: feature-registry 12/12 files 93/93 tests, network-identity and session-context 14/14 files 262/262 tests, all pass with 0 failed.",
  "created_at": "2026-08-18T12:30:00Z",
  "expires_at": "2026-11-15T00:00:00Z",
  "input_hashes": [
    "sha256:35fa8b353330c1969f5f5147aeed65dfcf7775fb4e6295a39ac9bc714d4a43be",
    "git:b941affb7c89021bb5662a7686fc52847a639e6c",
    "tree:327f27ca0c8d1daf6787c0925e53a26667c9258b"
  ],
  "scope_hash": "sha256:102415cdecb8ca6c30f1729adeb74eb566cbdf4c34098da9ded8f50656785a57"
}
