{
  "$schema": "https://appsdk.local/contracts/records/evidence-record.schema.json",
  "evidence_id": "evid-20260816-zarchv2-activev3-baseline-001",
  "issue_id": "zterm-runtime-architecture-v2",
  "experiment_id": "zterm-runtime-architecture-v2-active-v3",
  "phase": "baseline_reproduction",
  "kind": "red_test",
  "source_commit": "d626524",
  "artifact_hash": "sha256:ab527a800da96f8f1bb3b038649c5882f3e016dd0eef0749e32bb9a50ae152e8",
  "scope": {
    "module_id": "zterm-runtime-v2",
    "feature_id": "zterm_runtime_architecture_v2_appsdk_013_migration",
    "entrypoint": "appsdk verify android"
  },
  "producer": {
    "adapter": "appsdk+codex",
    "identity": "codex-zterm-v2-appsdk013-baseline-20260816T000000Z"
  },
  "result": "pass",
  "confidence": 1,
  "confidence_rationale": "Global AppSDK 0.1.3 rejects the pinned 0.1.2 project with MISSING_GOVERNANCE_MAP and NON_CANONICAL_RECORD_CONTRACT_SET; the baseline red test is recorded as pass because the failure was reproduced on unchanged source.",
  "created_at": "2026-08-16T00:00:00Z",
  "expires_at": "2026-11-14T00:00:00Z",
  "input_hashes": [
    "sha256:ab527a800da96f8f1bb3b038649c5882f3e016dd0eef0749e32bb9a50ae152e8",
    "git:d626524"
  ],
  "scope_hash": "sha256:f3d06524422c1892cc6bf0969a28d64f46be2efcf34e7fc233859d16feb31349"
}
