{
  "$schema": "https://appsdk.local/contracts/records/evidence-record.schema.json",
  "evidence_id": "evid-20260816-zarchv2-activev4-artifact-001",
  "issue_id": "zterm-runtime-architecture-v2",
  "experiment_id": "zterm-runtime-architecture-v2-active-v4",
  "phase": "artifact",
  "kind": "artifact",
  "source_commit": "519ffe2967699d1a6134bb10ffb1b10a71cb94b9",
  "artifact_hash": "sha256:c6379ad5edd522a5d11476a1b33694376cb4cf227dd7e3fc18af45e04ca55bb0",
  "scope": {
    "module_id": "zterm-runtime-v2",
    "feature_id": "zterm_runtime_architecture_v2_appsdk_013_active_v4_final_gates",
    "entrypoint": "appsdk compile-module android --module zterm-runtime-v2"
  },
  "producer": {
    "adapter": "appsdk",
    "identity": "appsdk-0.1.3"
  },
  "result": "pass",
  "confidence": 1,
  "confidence_rationale": "AppSDK 0.1.3 compiled the active-v4 module artifact and verified its source, contract, and public API hashes at 519ffe2.",
  "created_at": "2026-08-16T19:20:00Z",
  "expires_at": "2026-11-14T00:00:00Z",
  "input_hashes": [
    "sha256:c6379ad5edd522a5d11476a1b33694376cb4cf227dd7e3fc18af45e04ca55bb0",
    "git:519ffe2967699d1a6134bb10ffb1b10a71cb94b9"
  ],
  "scope_hash": "sha256:14abf6967a507e5300c4efd61f1526aa44a5b85acb879d34a0db98695d783720"
}
