{
  "$schema": "https://appsdk.local/contracts/records/evidence-record.schema.json",
  "evidence_id": "evid-20260816-zarchv2-activev4-changed-suites-001",
  "issue_id": "zterm-runtime-architecture-v2",
  "experiment_id": "zterm-runtime-architecture-v2-active-v4",
  "phase": "fix_candidate",
  "kind": "positive_test",
  "source_commit": "394679c85aa8dc869d727e72563025f7a63e5fb4",
  "artifact_hash": "sha256:127c8bf4aa74c594627d78c29addba98ea7ba03e886688c763c0e2b06777a2b7",
  "scope": {
    "module_id": "zterm-runtime-v2",
    "feature_id": "zterm_runtime_architecture_v2_appsdk_013_active_v4_final_gates",
    "entrypoint": "pnpm exec vitest run src/lib/session-render-buffer-store.test.ts src/components/terminal/FileTransferSheet.test.tsx src/hooks/useOpenTabRuntime.test.tsx --reporter=dot"
  },
  "producer": {
    "adapter": "vitest",
    "identity": "codex-zterm-v2-appsdk013-activev4-changed-suites-20260816T200500Z"
  },
  "result": "pass",
  "confidence": 1,
  "confidence_rationale": "Changed suites pass on the recorded source commit: session-render-buffer-store 10/10, FileTransferSheet 49/49, useOpenTabRuntime 5/5 (3 files / 64 tests). This records the suites intentionally excluded from the focused 297-test regression report.",
  "created_at": "2026-08-16T20:49:20Z",
  "expires_at": "2026-11-14T00:00:00Z",
  "input_hashes": [
    "sha256:127c8bf4aa74c594627d78c29addba98ea7ba03e886688c763c0e2b06777a2b7",
    "git:394679c85aa8dc869d727e72563025f7a63e5fb4"
  ],
  "scope_hash": "sha256:4000e2903bfd07ca1dce5853b83d2b4e947bf3cc54c9ec150c746082c07fdca8"
}
