{
  "$schema": "https://appsdk.local/contracts/records/evidence-record.schema.json",
  "evidence_id": "evid-20260816-zarchv2-activev4-verify-001",
  "issue_id": "zterm-runtime-architecture-v2",
  "experiment_id": "zterm-runtime-architecture-v2-active-v4",
  "phase": "fix_candidate",
  "kind": "gate",
  "source_commit": "2fa2eaea288fcfdf6ddde0a4a568d2385a4bbf08",
  "artifact_hash": "sha256:bfcfc97a0098dfe50fddd86b5596bbfcde3662439e865ab33c48a6a4b309b707",
  "scope": {
    "module_id": "zterm-runtime-v2",
    "feature_id": "zterm_runtime_architecture_v2_appsdk_013_active_v4_final_gates",
    "entrypoint": "appsdk verify android"
  },
  "producer": {
    "adapter": "appsdk",
    "identity": "appsdk-0.1.3"
  },
  "result": "pass",
  "confidence": 1,
  "confidence_rationale": "AppSDK 0.1.3 verify returns ok:true at 2fa2eae with stage controlled_verified and the locked 0.1.3 compiler digest.",
  "created_at": "2026-08-16T17:09:58Z",
  "expires_at": "2026-11-14T00:00:00Z",
  "input_hashes": [
    "sha256:bfcfc97a0098dfe50fddd86b5596bbfcde3662439e865ab33c48a6a4b309b707",
    "git:2fa2eaea288fcfdf6ddde0a4a568d2385a4bbf08"
  ],
  "scope_hash": "sha256:69a5969fce2950c26fd197cf156e6b3196ed78c1c3aaa1e94cd214d995f3fd48"
}
