{
  "$schema": "https://appsdk.local/contracts/records/evidence-record.schema.json",
  "evidence_id": "evid-20260817-zarchv2-activev4-main-baseline-001",
  "issue_id": "zterm-runtime-architecture-v2",
  "experiment_id": "zterm-runtime-architecture-v2-active-v4-main-closeout",
  "phase": "baseline_reproduction",
  "kind": "red_test",
  "source_commit": "b941affb7c89021bb5662a7686fc52847a639e6c",
  "scope": {
    "module_id": "zterm-runtime-v2",
    "feature_id": "zterm_runtime_architecture_v2_active_v4_main_baseline"
  },
  "producer": {
    "adapter": "appsdk",
    "identity": "appsdk-0.1.3"
  },
  "result": "pass",
  "confidence": 1,
  "confidence_rationale": "The baseline problem was reproduced on unchanged b941aff: the canonical active-v4 lifecycle still reviewed c11485f and artifact sha256:b36be6bb152fbcda62452d9879c41f3877637c14af68d3d49613a13c4b879397, so promotion would not represent the current main source.",
  "created_at": "2026-08-18T10:40:00Z",
  "expires_at": "2026-11-16T00:00:00Z",
  "input_hashes": [
    "sha256:a26c67f3706fdaf518f60fd7953c4942854bfef63e68c707939a101eb29f9404",
    "git:b941affb7c89021bb5662a7686fc52847a639e6c"
  ],
  "scope_hash": "sha256:e939fc3be8c64425b047abeb47a1c108890be6427825360f742cb7b44edb9790"
}
