{
  "$schema": "https://appsdk.local/contracts/records/evidence-record.schema.json",
  "evidence_id": "evid-20260817-zarchv2-activev4-determinism-001",
  "issue_id": "zterm-runtime-architecture-v2",
  "experiment_id": "zterm-runtime-architecture-v2-active-v4",
  "phase": "fix_candidate",
  "kind": "artifact",
  "source_commit": "c11485f9c72d3a59f548f2ef90824ef727e9be7b",
  "artifact_hash": "sha256:b36be6bb152fbcda62452d9879c41f3877637c14af68d3d49613a13c4b879397",
  "scope": {
    "module_id": "zterm-runtime-v2",
    "feature_id": "zterm_runtime_architecture_v2_appsdk_013_active_v4_final_gates",
    "entrypoint": "appsdk compile-module android --module zterm-runtime-v2 twice + shasum -a 256"
  },
  "producer": {
    "adapter": "appsdk",
    "identity": "appsdk-0.1.3"
  },
  "result": "pass",
  "confidence": 1,
  "confidence_rationale": "Two consecutive AppSDK 0.1.3 compile-module runs at c11485f produce identical zterm-runtime-v2.web.tgz sha256:a7d9261dbe414672adaa67b1db04e4a04528c89933de3ea8dce43358607349e1 and identical module.compiled.json, with ZTERM_BUILD_NUMBER pinned and deterministic ustar archive generation.",
  "created_at": "2026-08-17T07:26:00Z",
  "expires_at": "2026-11-14T00:00:00Z",
  "input_hashes": [
    "sha256:b36be6bb152fbcda62452d9879c41f3877637c14af68d3d49613a13c4b879397",
    "git:c11485f9c72d3a59f548f2ef90824ef727e9be7b"
  ],
  "scope_hash": "sha256:ad06d8f40b865c3b89440b0b0049a7c4a87ae9538a2163f98edf18903f31ac21"
}
