{
  "$schema": "https://appsdk.local/contracts/records/evidence-record.schema.json",
  "evidence_id": "evid-20260816-zarchv2-activev3-artifact-001",
  "issue_id": "zterm-runtime-architecture-v2",
  "experiment_id": "zterm-runtime-architecture-v2-active-v3",
  "phase": "artifact",
  "kind": "artifact",
  "source_commit": "44e23ef7b28cb265400e032e3338b52c19c7b65f",
  "artifact_hash": "sha256:a26c67f3706fdaf518f60fd7953c4942854bfef63e68c707939a101eb29f9404",
  "scope": {
    "module_id": "zterm-runtime-v2",
    "feature_id": "zterm_runtime_architecture_v2_appsdk_013_migration",
    "entrypoint": "appsdk compile-module android --module zterm-runtime-v2"
  },
  "producer": {
    "adapter": "appsdk",
    "identity": "appsdk-0.1.3"
  },
  "result": "pass",
  "confidence": 1,
  "confidence_rationale": "AppSDK 0.1.3 compiled the migrated module artifact and verified its source, contract, and public API hashes.",
  "created_at": "2026-08-16T00:45:00Z",
  "expires_at": "2026-11-14T00:00:00Z",
  "input_hashes": [
    "sha256:a26c67f3706fdaf518f60fd7953c4942854bfef63e68c707939a101eb29f9404",
    "git:44e23ef7b28cb265400e032e3338b52c19c7b65f"
  ],
  "scope_hash": "sha256:f3d06524422c1892cc6bf0969a28d64f46be2efcf34e7fc233859d16feb31349"
}
