{
  "$schema": "https://appsdk.local/contracts/records/evidence-record.schema.json",
  "evidence_id": "evid-20260817-zarchv2-activev4-main-artifact-001",
  "issue_id": "zterm-runtime-architecture-v2",
  "experiment_id": "zterm-runtime-architecture-v2-active-v4-main-closeout",
  "phase": "artifact",
  "kind": "artifact",
  "source_commit": "86076987a70345d88b90070f0014e8b2f243ca01",
  "artifact_hash": "sha256:a021a660aab1dc2d4a35a7c3ef0ab453428d70111bb3f71da5de7c21c94c2c18",
  "scope": {
    "module_id": "zterm-runtime-v2",
    "feature_id": "zterm_runtime_architecture_v2_active_v4_main_artifact",
    "entrypoint": "appsdk compile-module android --module zterm-runtime-v2"
  },
  "producer": {
    "adapter": "appsdk",
    "identity": "appsdk-0.1.3"
  },
  "result": "pass",
  "confidence": 1,
  "confidence_rationale": "AppSDK aggregate artifact identity sha256:a021a660aab1dc2d4a35a7c3ef0ab453428d70111bb3f71da5de7c21c94c2c18; the manifest separately binds the committed web bundle bytes as sha256:8af3e3b3a00355052cc48223c04e02e18f00b232180565a98f4ff2df607edc3f, with source sha256:a096788f1f066d5a8d6c6a6358943484ba462812fe934b377f92c01090685fb6 and public API sha256:42699f64b69d0e555a6b43baa29dd381e27c245b417f5c60bce8f7e6155e5abd.",
  "created_at": "2026-08-18T10:40:00Z",
  "expires_at": "2026-11-16T00:00:00Z",
  "input_hashes": [
    "sha256:a021a660aab1dc2d4a35a7c3ef0ab453428d70111bb3f71da5de7c21c94c2c18",
    "git:86076987a70345d88b90070f0014e8b2f243ca01"
  ],
  "scope_hash": "sha256:e939fc3be8c64425b047abeb47a1c108890be6427825360f742cb7b44edb9790"
}
